title,album,release_year,lyrics
звёзды все принадлежат богам,геометрия тьмы,2022,Ни любви ни ненависти ни жалости И я ползти давно готов от усталости Но не осталось ничего я напою себе под нос Что старости не боюсь И белый голубь символ мира ворона символ отчаянья Порою знаки значимы больше чем означаемы Нарративный тупик как выбраться из неволи Киваю идея есть и лишаю тебя символики Теперь ты просто птица улетай куда желаешь Я буду за тебя молиться чтоб пережила меня Пережила друзей пережила любовь переждала мороз А солнца мяч как на Ролан Гаррос Тудасюда день и ночь вторая ступень и первая ракетка Покидает землю это паритет Но нужны ли человеку звёзды и он нужен ли им сам Звёзды всётаки принадлежат богам А звёзды все принадлежат богам Их не поймать они не падают к ногам И не уместен торг по рукам Птице небо человеку смерть Звёзды все принадлежат богам Звёзды все принадлежат богам Их не поймать они не падают к ногам И не уместен торг по рукам Птице небо человеку смерть Звёзды все принадлежат богам И может есть чтото выше Что отличает птицу от летучей мыши Может крылья непохожи но окажется Разницы никакой ведь задача одна и та же Сами крылья ерунда ничё особенного в них нет Отчего берёза на Руси не утихнет никак не утихнет И на лесоповале столько лет Ёлки врали всему лесу смерти нет Но смерть это пространство смерть это длина и ширина И в своих странствиях через земную твердь Мышь и птица таки чувствуют поразному пространство И поразному так постигают смерть А может даже разную смерть и видны Были бы следы геометрии тьмы И чтобы с чем тогда соотнёс ты Небо океан любовь небытие звёзды Они далеко гдето там И даже те из них что сами пали к ногам не принадлежат нам Птице небеса рыбе океан Человеку смерть и звёзды богам А звёзды все принадлежат богам Их не поймать они не падают к ногам И не уместен торг по рукам Птице небо человеку смерть Звёзды все принадлежат богам Звёзды все принадлежат богам Их не поймать они не падают к ногам И не уместен торг по рукам Птице небо человеку смерть Звёзды все принадлежат богам И может есть чтото выше Что отличает птицу от летучей мыши Может крылья непохожи но окажется Разницы никакой ведь задача одна и та же
Сахарная вата,Сахарная вата,2018,Хoтитe поигpаться Вы разрешите поцелуй Но с условием не прикaсаться задачка Но если разобраться то всё просто Я попаду без смс и регистрации Давно остывший чай небезопасный секс Контрольная на два и мы не сдали тест да на совместимость Родная прости больше не поместилось Да ты только представь А если бы я мог всё записать на диск Передать волною мысли как радист Но такого и подавно отродись не видел я И киноартхаусный режиссер и сценарист это не то кино И всё просто будто дважды два Мы доиграемся однажды Да и бабочек заменит тошнота И заморозки ожидают но пока что ты горишь А раз горишь мое сердце тоже тает И я куплю тебе всю сахарную вату в лунапарке И мы оба виноваты не подарки Прощанияпрощение на вкус как вата Всё по личным ощущениям всё отдам И я затеял побег Тут движения нет и нет результатов Жизнь не лимонад а там облака как сахарная вата И пусть это наивно И я могу и один быть но без тебя там Всё одинаково стала безвкусной сахарная вата И я затеял побег Тут движения нет и нет результатов Жизнь не лимонад а там облака как сахарная вата И пусть это наивно И я могу и один быть но без тебя там Всё одинаково стала безвкусной сахарная вата Хотите проиграть а Ну или я проиграю вам чтоб очки все поменять Нам два билетика в закрытый кинотеатр Кинопленки крутит памяти ваш двадцать пятый кадр Двадцать пять ваших любимых образов Как у Уорхола Мерлин Монро я берегу для вас один патрон И если станет скучно ну прямо совсем И для побега всё готово нужно лишь дойти до ручки И через помехи электрических полей Но я под контроль беру твою приборную панель И ее всё функции режимы и таланты Элементы все что есть от конденсатора до лампы И вам программу обороны поменять поздно Я целую вас ракетами землявоздух А вы будто и не против не ради но рады Этот бой проиграть мне Сложновато ну а че нам А че И дабы понимать не нужно быть ученым То что если в одиночку аппарат включен и че Без тебя вся вата в парке ни о чём И я затеял побег Тут движения нет и нет результатов Жизнь не лимонад а там облака как сахарная вата И пусть это наивно И я могу и один быть но без тебя там Всё одинаково стала безвкусной сахарная вата И я затеял побег Тут движения нет и нет результатов Жизнь не лимонад а там облака как сахарная вата И пусть это наивно И я могу и один быть но без тебя там Всё одинаково стала безвкусной сахарная вата
Альма-матер,"Питер, чай, не Франция",2020,Биться о стену да лица ломать и лица ломать Где огрызки под ноги бросает кормилицамать им как вороне кочаны Что для первого будет конец для второго начало Все хотят золотого тельца только чья бы корова мычала Мычала от боли мычала рожая урода Рожая поколе кричала от ржавой гарроты И нежное горлышко матери слоями расходится надвое И складками скатерти свернулась кровь то цена твоя за своих же детей Альмаматер Крутятся винтики и лопают гаечки Кто был не любим так и не будет Играючи я лопаю гаечки И как элеватор ахахаха С утробы земли подниму альмаматер Крутятся винтики и лопают гаечки Кто был не любим так и не будет Играючи я лопаю гаечки И ломаю шурупы ахахаха А всё походящее на мишуру ты Тянешь в свой рот что шуршит и блестит Ворошить в полости как вершить и блюсти так Свой материнский долг и тянется нить в иголку Доктор поник умолк мол А Бог с ней не жаль Альмаматере так что подохни рожай И подохни рожай Людей без лица и без мимики Все похожи но ты только намекни Что сходящая каждый раз мимо к ним Вероятности точка в динамике Развернётся кривою над нами где Затрясёт в пиках будто от тремора Значит выкидыш точно одна из двух Новорожденных точек экстремума Крутятся винтики и лопают гаечки Кто был не любим так и не будет Играючи я лопаю гаечки И как элеватор ахахаха С утробы земли подниму альмаматер Крутятся винтики и лопают гаечки Кто был не любим так и не будет Играючи я лопаю гаечки И ломаю шурупы ахахаха
Легенда о Богине Мечей,Легенда о Богине Мечей,2023,Впереди Terra Incognita позади империя Дороги не протоптаны и всё что было перед ними Покоряя двигал дальше Император армию на север Их огни величия ведут тени тянут лапища Пустыня на пути посередине капище Обходить не хочется и нога в ногу Через жертвенник преграждающий дорогу Вдалеке лес на закате ровный будто вылизан Но внезапно перед ними ниоткуда вылезла Богиня и все легионы в одиночку вырезала От увиденного ему тут же башню вынесло Надо бежать но чтото трепетно стучит Непривычно для него и возвращаяся в ночи К той резне и оглядывая вновь Заваленную трупами пустыню понял что это любовь В её кровавый пируэт император психопат Втюрился как школьник но не понимает как теперь Связать хотя бы пару слов Чтобы признаться ей в любви на языке клинков Вот такая акробатика патетика вины Поэтики грамматика фонетика войны Это лингвистика мечей она не знает языков других Гремит музыка клинков рифмуя стих Добро без лица зло без вины Праксис клинков логос войны Орущая сталь в ней речь улови Вечная бойня для вечной любви От этих яростных красных очей Его сердце цветёт как картофелина Кровушка льётся в Богине Мечей Разом сплетётся любовь и война Крик срывается с клыков она примальный Бог Явившийся за звуками клинков И кто пережил замес с Богинею Мечей Героями считалися в эпоху древних Королевств Но те времена ушли культурный слой наращивая жир Скрывает башен высоченных этажи Человечества следы кончались на материке Цивилизации тут нет и войн не видано нигде А потому не выходя на свет Она спала на своём капище шестнадцать тысяч лет Но заголосят теперь они Молчавшие клинки они разбужены солдатами империи Проблема настоящая как чаще с нею видеться Одна ему идея гениальная пришла Любовь его воистину была сильна Он понял чтобы вместе быть им нужна вечная война И затеял авантюру чтобы встречаться с нею Он развязал войну одновременную со всеми народами И тысячи солдат каждый год без речей Молча на убой Богине Мечей Отправляет умирать чтоб самому смотреть и От её фигур в кровавом пируэте Он тянется к ширинке без дураков Говорит теперь весь мир на языке клинков Добро без лица зло без вины Праксис клинков логос войны Орущая сталь в ней речь улови Вечная бойня для вечной любви От этих яростных красных очей Его сердце цветёт как картофелина Кровушка льётся в Богине Мечей Разом сплетётся любовь и война Сливается грамма и фоно клинков Разгорается драма под вонь угольков И сшиты в один опус людьми Войны логос и лотос любви Сливается грамма и фоно клинков Разгорается драма под вонь угольков И сшиты в один опус людьми Войны логос и лотос любви
мы попадём с тобою в ад,mea maxima culpa,2025,Мы попадём с тобою в Ад При мне вянут цветы При тебе свечи не горят Хочу сорваться Ты так хочешь быть у алтаря Куда ведут следы Нас и под вечер Янтаря шарик на горизонте Катится восвояси Пламенным колесом как будто бы посмеясь Испачканная луна Улыбается полумесяцем От неё будто боль унимается и нам грезится Дом и его уют Но кроме огня и вьюг Не ждёт ничего Никак не отмыться От наших рук Бить перестают ключи В лесу засыхает пруд Гниёт под тобой земля Воробьи надо мною мрут Мы попадём с тобою в Ад При мне вянут цветы Не горят свечи там где ты Мы попадём с тобою в Ад Пускай мы жили всуе ты Для меня стала суетой от суеты Мы попадём с тобою в Ад При мне вянут цветы Не горят свечи там где побывала ты Мы попадём с тобою в Ад Бог знает в чём мы виноваты Просто надо так Поэтому потом Мы попадём с тобою в Ад Сколько бы не узрел путей Люди пешки в игре богов Боги ферзи в игре людей А мир как двухэтажная шахматная доска В океане небытия где ни камешка ни песка Форменная тоска Фирменные мазки Зефирная мякоть Время эфирное к десяти По старенькому ТВ Кино Гибсона про Христа Мы пытаемся говорить Но мой голос охрип и стал Слова подбирая скуп Небрежно срываю с губ Как стаю больных собак Зацикленных будто луп Не впишет ни круг ни куб Ты карга я твой инкуб Декарту нас не понять Мы cogito без ergo sum Мы попадём с тобою в Ад При мне вянут цветы Не горят свечи там где ты Мы попадём с тобою в Ад Пускай мы жили всуе ты Для меня стала суетой от суеты Мы попадём с тобою в Ад При мне вянут цветы Не горят свечи там где побывала ты Мы попадём с тобою в Ад Бог знает в чём мы виноваты Просто надо так Поэтому потом Мы попадём с тобою в Ад
чёрное сердце,чёрное сердце,2022,Звонки без ответа Твоё холодное сердце запретно но так безупречно И я на коленях Держу твоё чёрное сердце что я изувечил Это так прекрасно но мне нужно побороть В телефонной книге психиатр и Господь И мне некуда бежать я не играю роль Хочу тебя желать пока живой Но я чувствую что я живой Когда бухой и когда мешаю фарму с наркотой Разожги огонь и подари мне ночь Ведь даже невменоз приятней чем твоя любовь Звонки без ответа Твоё холодное сердце запретно но так безупречно И я на коленях Держу твоё чёрное сердце что я изувечил Звонки без ответа Твоё холодное сердце запретно но так безупречно И я на коленях Держу твоё чёрное сердце что я изувечил Надо поторопиться Держатся пока ноги Я маленький как принц Ты принцесса как Мононоке Пахнешь как аммиак А в горле моём комок Не гасят пока маяк Я шёл по нему как мог Птица лети на юг Неси вести до берегов Моя звёздочка я с тобой Мы созвездие дураков Мы содействие мы предел Мы абстракция интертекст Мы семейство небесных тел Я реакция ты рефлекс Звонки без ответа Твоё холодное сердце запретно но так безупречно И я на коленях Держу твоё чёрное сердце что я изувечил Звонки без ответа Твоё холодное сердце запретно но так безупречно И я на коленях Держу твоё чёрное сердце что я изувечил Звонки без ответа Твоё холодное сердце запретно но так безупречно И я на коленях Держу твоё чёрное сердце что я изувечил
ОКО,ОКО,2022,2022 2022 2022 2022 Задержи дыхание Курёхин одновременно и движется и спит релятивистская механика Спин вращается наоборот неслыханно Срывается фотон совершена работа выхода В ядре бардак протоны все пропали Молодые электроны покидают орбитали Но по постулату Бора те хватаясь за карниз Обречены терять энергию и вновь срываться вниз В одном шаге от свободы жаль как ни пытаться В шаге от освободительной ионизации Я формулы записываю мелом на стене Когдато наши дети может скажут ненависти нет А для ракеты все равны мы и ей не важен вид и род Невыносимо тяжело дышать тяжёлый водород Уже везде дрожит земля а вокруг горит материя узрите И скажите да дейтерию и тритию С нами Бог над нами термоядерное око С нами Бог а значит теперь я не одинок И с нами Бог над нами термоядерное око Что с землёю наш сравняет городок Я заключаю с нами Бог над нами термоядерное око С нами Бог а значит теперь я не одинок А с нами Бог над нами термоядерное око Что с землёю наш сравняет городок И заключаю с нами Бог Как Керуак я возвращаюсь on the road По Тихоокеану вязко тянется дредноут И как не игнорируй становится только хуже С годами осознаёшь что романтики нет в оружии И в мгновение ока в один присест Сплетается мирный атом злой рок и мирный протест Принцип неопределённости да всё гори углём Мы в принципе живём так будто принцип не определён Элементарные частицы мы дети полураспада Так хочется причаститься нам встретить пора закат E равно mc квадрат даёт импульсами Бога частица Термоядерному синтезу добро так по итогу Остаётся выглядывать из окопа Божественное давление света от изотопа Ярче тысячи солнц а грядущее темней тысячи лун Я преклоню чело так что точи колун руби башку мою Где Бог Над нами термоядерное око Где же Бог На выжженной земле так одиноко Где же Бог Над нами термоядерное око Что с землёю наш сравняет теремок Я заключаю где же Бог Над нами термоядерное око Где же Бог На выжженной земле так одиноко Где же Бог Над нами термоядерное око Что с землёю наш сравняет теремок Я заключаю где же Бог Над нами термоядерное око С нами Бог а значит теперь я не одинок И с нами Бог над нами термоядерное око Что с землёю наш сравняет городок Я заключаю бабах
