title,album,release_year,lyrics
чужие песни,чужие песни,2023,Фигуры одной игры Мы мечены как икры Два зёрнышка гдето нам Бы литра по полторы И в сказочные миры Не вылезу из норы Чтоб слог мой изпод пера Был вылизан до поры Ускользает последний лучик Дневной уступая тьме Над Невою не видно тучек давно Потакая мне река замерла не бежит Мне кажется в самом деле У каждой реки на свете должна быть своя Офелия Зачем весь этот сюр Растворись в моей комнате Ведь я принял панацею из аргентума зная что Тебе нужен другой а я просто подопытный Ведь я съем твои истерики таблеткой бессонницы Расскажи как я не прав что тебя тянет обратно Вернуться в теплоту этих стерильных объятий Но снова отступлю на два шажочка назад Чтобы восстановиться ведь чувствую что внутри меня пустота Флуоресцентной краской окажутся восприятия Измазанная морда покажется синим пламенем И чувство что я больше ничего не ощущаю окажется правильным Скажи зачем ты врёшь мне в глаза Я правда больше не хочу тебя ощущать Мне не нужна забота мне не нужна любовь Мне нужна одна рука что не позволит мне упасть на дно Можешь уходить в чужие песни В чужие руки в чужие деньги Можешь уходить никто не держит Ничто не держит Я давно отпустил Можешь уходить в чужие песни В чужие руки в чужие деньги Можешь уходить никто не держит Ничто не держит Как напьюсь так впадаю в патетику Хулиганю ломаю комедию Я прошёл боль меня не заметила В воспалённом мозгу теоретика Мы ушли в себя Когда вернулись Всё изменилось вплоть до геометрии улиц Я уже не готов с ней делить постель Вот нелепость любовь с молодых ногтей Что ты оставишь после себя мне Что я оставлю после себя ей Где терпимость к недоразумениям Как же вышло что мы ни во что не верили Ну да у нас разные отрицательные Открой глаза мы на празднике созерцания Позволь мне делать всё что нельзя Ведь в этой вселенной мы снова только друзья Можешь уходить в чужие песни В чужие руки в чужие деньги Можешь уходить никто не держит Ничто не держит Я давно отпустил Можешь уходить в чужие песни В чужие руки в чужие деньги Можешь уходить никто не держит Ничто не держит Люди движутся хаотично плавают по течению Поджигают спички и пьют до изнеможения Вредные привычки смертельные последствия Не просим о спасении молча терпим бедствие Сжимаю крепко руки вдруг завтра станет получше Настанет новое утро утром всё так же грустно В полках чернеют книги во рту чернеют зубы А я лежу на простынке словно ёбаный труппи Ничё не дарит кайф в уме большие суммы Не заговаривай мне зубы я знаю ты супер Мне нужно чтото чтобы чувствовать снова пасуешь Люди бьются как кегельбан лезут на амбразуры Люди хотят любовь из книг или любовь из порно Меня трахает эта жизнь но мне больше не больно Строить любовь сизифов труд где раз за разом пропасть Так что просто разбей о пол что я для нас построил и уходи достойно Можешь уходить в чужие песни В чужие руки в чужие деньги Можешь уходить никто не держит Ничто не держит Я давно отпустил Можешь уходить в чужие песни В чужие руки в чужие деньги Можешь уходить никто не держит Ничто не держит Я давно отпустил
Кто же перерезал небу горло?,Терновый венец эволюции,2017,Пускай я бездарность и самодур Но слово каждое цепляет за сердце будто гарпун И это сердце меня тащит в глубины бездонных вод Я стоически терплю ураган и водоворот И доктор мне никак не помог И вокруг кровью размазанный небосвод Этот труп падает выжигает дотла чего коснётся И такой вес не выдержит и Атлант Кости ломаются пополам И в каналах кровь растекается по полам коммуналок В клетке бетонных моноквартир Но дай свободу сердцу и оно столько наворотит И я бы свой укромный уголок поменял Ещё чутьчуть и небо упадёт на меня и на всех Я поднял бы на смех что упало на нас Но где смех там нас нет И свой бы потопить галеон насовсем Поглубже и туда где миллион атмосфер Подальше унести бы всё прочь но кто Мне расскажет как всем отомстить и помочь а И способа нету само собой и пока Доказать свою ненависть и любовь дуракам Буду тыкать нож в потолок И красный закат на руках я Суини Тодд И если в небе красный закат то бесспорно Значит перерезал небу ктонибудь горло И так сложно чтонибудь сказать помоги Но нам нечего и некого спасать ты пойми И если в небе красный закат то бесспорно Значит перерезал небу ктонибудь горло И так сложно чтонибудь сказать помоги Но нам нечего и некого спасать Тысячи фраз из моментов тех дней что когдато давно пережил Тысячи фраз о которых жалел режут нежнуюнежную шею Тысячи фраз о которых когдато жалел взяли в руки ножи И из тысячи ран текут тысячи фраз о которых ещё пожалею Первый дурак последний герой и правда в том Что тут обуть всех мечтает голый король И ты подумай только пeсня абсурд весь не передаст Когда везде слепые люди открыть хотят Третий глаз И все целят кудато как автомат Но не попасть никак и сбита система координат Путь судьбы как не крути никогда неповторим Но я носом чую то что все дороги ведут в Рим прикинь Столько принято что никогда не счесть И на рынке душ давно нарушился обмен веществ И как на своём не стоять упрямо Только время нас затянет в гроб но никак не затянет раны Просто забудь Посмотри со мною в даль Как облаками кровь размажет горизонт всем непокорный И если ты когданибудь увидишь это всё То угадай кто же перерезал небу горло И если в небе красный закат то бесспорно Значит перерезал небу ктонибудь горло И так сложно чтонибудь сказать помоги Но нам нечего и некого спасать ты пойми И если в небе красный закат то бесспорно Значит перерезал небу ктонибудь горло И так сложно чтонибудь сказать помоги Но нам нечего и некого спасать Тысячи фраз из моментов тех дней что когдато давно пережил Тысячи фраз о которых жалел режут нежнуюнежную шею Тысячи фраз о которых когдато жалел взяли в руки ножи И из тысячи ран текут тысячи фраз о которых ещё пожалею Тысячи фраз из моментов тех дней что когдато давно пережил Тысячи фраз о которых жалел режут нежнуюнежную шею Тысячи фраз о которых когдато жалел взяли в руки ножи И из тысячи ран текут тысячи фраз о которых ещё пожалею
я верю только в неизбежность зла,геометрия тьмы,2022,Всем выйти из сумрака выйти и зайти нормально Но какникак тут не найти мораль но я вообразил подетски Война света из себя и в зеркалах ищу чудовищ как Антоха Городецкий И каждым утром нахожу Оттопырив веки вижу смотрит соскалившийся упырь И во имя добра я бью но стекло без ответа Я вдруг понял секундой позже что нежить та это я И клянусь издалека ма Причудилось на миг что встала в буквы разбитая амальгама И как будто мысль изрекла Почему меня всю жизнь везде преследуют блядские зеркала Взаимно искажая отражения Я верю не в непобедимость зла а в неизбежность поражения Георгия Иванова слова аа Но не держите за осла меня Я верю только в неизбежность зла Я верю только в неизбежность зла Не верю в чудеса как говорят Но это про то что на алтаре хоть режь козла Я верю в вероятное добро И верю в неизбежность зла И я верю только в неизбежность зла Не верю в чудеса как говорят Но это про то что на алтаре хоть режь козла Я верю в вероятное добро И верю в неизбежность зла Друг друга отражают зеркала аа Друг друга и взаимно искажая отражение А что если не так И правда в том что зеркала не искажают ничего а отражают искажение Что если сам и есть я искажение И был таким до зеркала давно Это дивно или дурно И есть вопрос но могут знать ответ лишь тени Я искажался постепенно или был таким с рождения Ах так много на кону И я могу всё проиграть Но мне не ясно только проиграть кому В игре судьбы игре ума добра и зла воображения Я верю в неизбежность но не верю в поражение И никак не сходится ты как не подведи Но я клянусь то что когданибудь свяжу всё воедино И затяну небрежно два узла Я верю не в его непобедимость верю в неизбежность зла И я верю только в неизбежность зла Не верю в чудеса как говорят Но это про то что на алтаре хоть режь козла Я верю в вероятное добро И верю в неизбежность зла И я верю только в неизбежность зла Не верю в чудеса как говорят Но это про то что на алтаре хоть режь козла Я верю в вероятное добро И верю в неизбежность злa Я верю только в неизбежность зла Не верю в чудеса как говорят Но это про то что на алтаре хоть режь козла Я верю в вероятное добро И верю в неизбежность злa
Танцуй полумесяц,Eclipse,2016,Ты как будто Луна В каждой капле вина как пелена Не передать тут мне никак то что хочу Ведь так малоёмки слова Пей и смейся Не бойся не проси а пей и смейся Я целую тебя в лоб полумесяц И близится тьма и затмение И мне не хватит и тысячи песен Я боюсь не успеть И я видел только крах неуспех И я глуп и я слеп но иду всё на свет Отражённый Луной от поверхности рек Прячешь волосы клипсами Солнце скрываешь собой как Эклипс Но мне кажется будто бы тьма без границ И я ненавидел но не смог тут испепелить всё Испепелить всё И всё так бесит а ты Лишь безжалостно смейся Весёлая ночь пока всё куролесят Мне горло царапает серпполумесяц Шею давит что даже не спеть Моя Селена на шабаше ведьм И под глазом сверкающей ночи Я так безоружен и вне полномочий С каждым разом лишь всё недоступней Далёкий сверкающий спутник Подай ориентир и не дай утонуть мне Снова запутался я на распутье И пока не погиб молодой Под слёзы Луны подставляю ладонь И чтоб сохранить тут хоть чтото потом Я снова собрал девять песен в альбом Танцуй Танцуй моя радость танцуй Танцуй полумесяц на поле тюльпанов Луна расцвети самым ярким бутоном Богини что с неба упала Танцуй полумесяц танцуй Танцуй полумесяц танцуй Уводя за собой в темноту Веселись но не плачь Умоляю ведь слёзы тебе не к лицу Танцуй Танцуй моя радость танцуй Танцуй полумесяц на поле тюльпанов Луна расцвети самым ярким бутоном Богини что с неба упала Танцуй полумесяц танцуй Танцуй полумесяц танцуй Уводя за собой в темноту Веселись но не плачь Умоляю ведь слёзы тебе не к лицу В руках телефон я боюсь не успеть И одна нога здесь и я как телепорт И мне так нелегко я устал чтото ждать Бесконечно смотреть в монитор Все вещи запачканы двери на крышу Вскрываю кусачками Быть чуть поближе К холодному шару Мне кажется всё таким Неоднозначным и странным отсюда Вижу символ и знаки и вижу всё то Что мне лучше не знать И хотел научиться летать по ночам Чтоб поближе к луне только лёжа в кровати И под ветер и грома раскат моё Сердце горит и танцуй у костра Я зависим и болен и звёзды все против Но лунная пыль самый лучший наркотик Я глуп и несу околесицу На твоём теле печать полумесяца И пусть наш век будет очень коротким Танцуй я прошу без остановки Танцуй Веночек и платье в ажур Я сердцем клянусь никому не скажу Что ты ночью под тени спустилась с Луны Позабыв о Богах танцевала с людьми И вихрем запляшет Селена И в свете огней заблестит Диадема Реальная можно дотронуться пальцем Богиня Луны утонувшая в вальсе Клянусь эту ночь не забуду И светят глаза будто два изумруда Но близится день и пока не расстались Рискну пригласить полумесяц на танец Танцуй Танцуй моя радость танцуй Танцуй полумесяц на поле тюльпанов Луна расцвети самым ярким бутоном Богини что с неба упала Танцуй полумесяц танцуй Танцуй полумесяц танцуй Уводя за собой в темноту Веселись но не плачь Умоляю ведь слёзы тебе не к лицу Танцуй Танцуй моя радость танцуй Танцуй полумесяц на поле тюльпанов Луна расцвети самым ярким бутоном Богини что с неба упала Танцуй полумесяц танцуй Танцуй полумесяц танцуй Уводя за собой в темноту Веселись но не плачь Умоляю ведь слёзы тебе не к лицу Танцуй Танцуй Танцуй Танцуй ooo Танцуй полумесяц танцуй Танцуй Танцуй полумесяц танцуй ooo
Ума Турман,Ума Турман,2021,Эй девчонка за баром утри свои слёзы Коньячок и с ним пару бокалов нам бармен принёс и Тут уж как ни крути но напитки придётся распить И кто тебя обидел кто кто же тебя так обидел что От одного взгляда мне самому дурно Глаза полны злобы ну прям Ума Турман Ну ну а Билл твой дебил я бы бля просто забил А была б у меня Ума Турман то я б её точно любил Зуб даю точно любил бы Девочка плачет а значится Мальчику девочка поровну Стрелочка стёрла всё начисто Пулею мчится по городу Девочка плачет а значится Мальчик и девочка поровну Стрелочка стёрла всё начисто Пулею мчится по городу Пулею мчится по городу Пулею мчится по городу Пулею мчится по городу Моя Ума Турман Был бы я Тарантино была бы своя Ума Турман Но я не Тарантино такой каламбур бля Ну я конечно сопля вдруг загрустил опосля я пиво допил Местные панки на сцене шумят как сто пил орут за гроши Музыка честно говно но зато от души и Я на миг отвернусь и девочка кудато сбежит И всё это карикатурно В стёклышко пьяный фронтмен И я грубо ору ему в ухо Голубчик родной а сыграй Uma2rmaH а Девочка плачет а значится Мальчику девочка поровну Стрелочка стёрла всё начисто Пулею мчится по городу Девочка плачет а значится Мальчик и девочка поровну Стрелочка стёрла всё начисто Пулею мчится по городу Пулею мчится по городу Пулею мчится по городу Пулею мчится по городу Моя Ума Турман Девочка плачет а значится Мальчику девочка поровну Стрелочка стёрла всё начисто Пулею мчится по городу Девочка плачет а значится Мальчик и девочка поровну Стрелочка стёрлась начисто Пулею мчится по городу Пулею мчится по городу Пулею мчится по городу Пулею мчится по городу Моя Ума Турмaн
