title,album,release_year,lyrics
эдельвейс,геометрия тьмы,2022,Кукукуку Не сгори не околей Вся кукукуха моя песенкою лейся Пока ещё в графине эдельвейс во мне дрожь и груша сердца Погодя вотвот пустится в драмнбейс пустится в драмнбейс А я решил по сумасшествию Мне бы отдохнуть и может быть попутешествовать Вот в Афины или Барсу А я сижу на лавке и пью пиво в ожидании катарсиса Ах какая Барса бля нечя делать в Греции Остаться куда лучше хоть и Питер чай не Франция хаптьфу Я чую русским языком металл и серу Гонит воздух но я радуюсь что CocaCola Zero Всё ещё такая же вкусная как вчера Всё это потoму что ещё кроме прочих та Меня не стало как гаранта индикатор наконец И если кола не такая как вчера значит миру пришёл пиздец хахаха Не сгори не околей Вся кукукуха моя песeнкою лейся Пока ещё в графине эдельвейс во мне дрожь и груша сердца Погодя вотвот пустится в драмнбейс пустится в драмнбейс Не сгори не околей Вся кукукуха моя песeнкою лейся Пока ещё в графине эдельвейс во мне дрожь и груша сердца Погодя вотвот пустится в драмнбейс пустится в драмнбейс Дорогая плети колечко Сгорая с неба сорвётся пятиконечник Лети за ним ты вослед и воспламенись Он задуман как подобие но только вот слеплен на отъебись Спета песня я после вас И даже коль по букве бы раздать их всему миру останется про запас Кому семья кому карьера и монетки А мне важно лишь одно остальное всё проблема вагонетки И того кто будет дёргать за рычаг И мне насрать о чём на рельсах перепугано кричат Зато каждой паре тварь а как на сотни тысяч тёмных дураков Так Бог на всех сука бля дал один фонарик сука Ничё не знаю бля свети себе сама А я пятый год пытаюсь не сойти с ума И кроме вопля боли ужаса отчаяния Мне кажется что в общемто отлично получается Снова я блюю а позже я блюю снова Ах просто не ебаться как же я люблю слова Леплю слово язык не сможет меня взять так на слабо И не мечтать И коль захочется буду свой рэп мычать атьать Вытираю пот с лица Верю что смогу всё пережить опять и как всегда не ёбнуться Песня моя лейся Тем более раз выжить вышло даже у какогото цветочка эдельвейса Не сгори не околей Вся кукукуха моя песенкою лейся Пока ещё в графине эдельвейс во мне дрожь и груша сердца Погодя вотвот пустится в драмнбейс пустится в драмнбейс Не сгори не околей Вся кукукуха моя песeнкою лейся Пока ещё в графине эдельвейс во мне дрожь и груша сердца Погодя вотвот пустится в драмнбейс пустится в драмнбейс Не сгори не околей Вся кукукуха моя песeнкою лейся Пока ещё в графине эдельвейс во мне дрожь и груша сердца Погодя вотвот пустится в драмнбейс пустится в драмнбейс Не сгори не околей Вся кукукуха моя песeнкою лейся Пока ещё в графине эдельвейс во мне дрожь и груша сердца Погодя вотвот пустится в драмнбейс чё Не сгори не околей Вся кукукуха моя песeнкою лейся Пока ещё в графине эдельвейс во мне дрожь и груша сердца Погодя вотвот пустится в драмнбейс
диско элизиум,диско элизиум,2022,Меня сдавит в пружину Если ладан прям перед тобою просто не дыши И скажи мне не прав я что ли Мы вернёмся однажды в свободный город Ревашоль и наведём суеты Диско инферно Диско элизиум диско бессмертно Диско посмертия дико как ось Я вращаюсь ломая берцовую кость А верность она как травка солодки И хрупкая вечность пахнет селёдкой И дружба селитрой и наш обострён нюх А любовь пахнет нашатырём Андрюх не грусти на нюх она та ещё Неприятна зато отрезвляющая Извращающе непрощающая Удушающе вдохновляющая Ощущается как монополия Всепрощающая моя боль и я Не любим но как будто зависим И всё падаю в диско элизиум Ощущается как монополия Всепрощающая моя боль и я Не любим но как будто зависим И всё падаю в диско элизиум Дискотека дискошар Диск луныредиски пожар В язык попадись ему Запылает под музыку диско мой диско элизиум Дискотека дискошар Диск луныредиски пожар В язык попадись ему Запылает под музыку диско наш диско элизиум Как не ругать небосвод отрекаться& Клетка реальна свобода абстракция Боль неизбежна страдание выбор Любовь безутешна я себя бы выпорол Образцово Не видать мне счастья простого Человеческого так и быть У искусства большая цена её надо платить А оно того стоит Не знаю То бишь значит не знаю как может иначе быть Почеловечески чтоб и за тексты Я плачу дорого с самого детства Это от Дьявола или от Бога Это не выбор и не дорога Привычная боль с ней тексты и пение Безусловны как сердцебиение Ощущается как монополия Всепрощающая моя боль и я Не любим но как будто зависим И всё падаю в диско элизиум Ощущается как монополия Всепрощающая моя боль и я Не любим но как будто зависим И всё падаю в диско элизиум Ощущается как монополия Всепрощающая моя боль и я Не любим но как будто зависим И всё падаю в диско элизиум Ощущается как монополия Всепрощающая моя боль и я Не любим но как будто зависим И всё падаю в диско элизиум Дискотека дискошар Диск луныредиски пожар В язык попадись ему Запылает под музыку диско мой диско элизиум Дискотека дискошар Диск луныредиски пожар В язык попадись ему Запылает под музыку диско наш диско элизиум диско элизиум
нежное электричество,геометрия тьмы,2022,У всех вокруг паралич Тлея в её ладони ждёт вдоха Aroma Rich Комната заливается хохотом гомерическим В проводе льётся похоть и нежное электричество В ресницах мог Между искрится ток и как прежде её величество И после тебя повсюду пепелище коль ты неистово хороша И вид на все две тыщи вольт Мы не виделись тыщу лет Помню как оседлав грозу Девчонка сидя на молнии тянет луны косу Но мы оба уже не те и сменили давно по царству Нейлон на металл и с ними романтику на коварство Но я уж давно привык что тёплый холодный свет Звучащий в полтона запах солёный невкусный цвет Смердящее прикасание блядское платоничество Вода грубая нежное электричество Всё наше прежнее смежное и практически Бьёт меня её нежноенежное электричество Какнибудь мы замкнёмся конечно и всё внутри чисто Если теоретически нежное электричество убьёт нас Всё наше прежнее смежное и практически Бьёт меня её нежноенежное электричество Какнибудь мы замкнёмся конечно и всё внутри чисто Если теоретически нежное электричество убьёт нас Буря не спешит безмолвие Эхо загудит и за окном пушится молния Слепясь в комочек ток слепясь в комочек ток Комочек станет в будущем грозой могучей Ток пронзающий облака и пока ещё во благое Пугающий но пока угрожающий не такой А нависшая радуга огибает земли покров И там где электродуга уродится дитя ветров И меж нами пробил разряд Хм разряд дваряд триряд Пускай полностью сгорят пусть горят И до комы мне знакомое прежде уже внутри чувство Я помню это нежноенежное электричество Всё наше прежнее смежное и практически Бьёт меня её нежноенежное электричество Какнибудь мы замкнёмся конечно и всё внутри чисто Если теоретически нежное электричество убьёт нас Всё наше прежнее смежное и практически Бьёт меня её нежноенежное электричество Какнибудь мы замкнёмся конечно и всё внутри чисто Если теоретически нежное электричество убьёт нас Нежное нежное Нежное нежное Убьёт нас убьёт нас Нежноенежное Нежноенежное Убьёт нас
ветрянка,геометрия тьмы,2022,Ты сидишь на окне ноги свесила вниз И весело в лист уперев карандаш Аж так что насквозь Я бегу за тобой на последний этаж И нас косит по мартовским дням как котят Не то чтобы прям тяготят эти пляски Но пару секунд погодя Я срываюсь к тебе ну а ты как обычно потрясна Я в тряске потрескал стеклянное облако Будто бы лампочка лопнуло лампочка лопнула Сменя свои облики Падали прямо на лоб было Падали звёзды и в глаз в твоём омуте зыбь Но на небе не звёзды а сыпь То бишь звёзды ветрянка И на лбу теперь сто дыр и ямка Наивные фразы ребёнка И песенка та же всё прям как В тот день я мажу зелёнку нана ветрянку нана ветрянку Зелёнкою нана ветрянку Зараза от первой любви Раночка вновь не болиииии Курю в темпе окурок тушу Поднимается температура температура И в груди такой жар что клубится у стен пар а дура Дуралуна лезет в прямо окно как из пряника но Всё приехали брежу Жёлтая рожа жирная туча Возьмука я ножик и брюхо порежу пузатому небу Мирных атомов нет но и мира без атома нету Без войны нету песни никак И увы нет любви без болезни Мне эта ветрянка как ночному дозору воронка И коль на вопрос Когда встретимся вновь Ты не смог дать ей чёткий ответ никогда То учись у ворон каркар never more Наивные фразы ребёнка И песенка та же всё прям как В тот день я мажу зелёнку нана ветрянку нана ветрянку Зелёнкою нана ветрянку Зараза от первой любви Раночка вновь не болиииии Наивные фразы ребёнка И песенка та же всё прям как В тот день я мажу зелёнку нана ветрянку нана ветрянку Зелёнкою нана ветрянку Зараза от первой любви Раночка вновь не болиииии Наивные фразы ребёнка И песенка та же всё прям как В тот день я мажу зелёнку нана ветрянку нана ветрянку Зелёнкою нана ветрянку Зараза от первой любви Раночка вновь не болиииии
Помогите Элли,Помогите Элли,2018,И Элли возвратится И Элли возвратится И Элли возвратится Домой домой домой домой домой В мире том где есть дом до родного далеко А там и близко никакого в другом Ищу вход до сих пор; и я прошу Скорей открой врата в свой Изумрудный Город В мире том где есть дом до родного далеко А там и близко никакого в другом Ищу вход до сих пор; и я прошу Скорей открой врата в свой Изумрудный Город Мир не злой просто под ложкой накипело Себя сложно удержать когда ладошка онемела Эй Подскажите возникла одна проблема Мы все ждём вот только Элли не может найти где вена Всё серьезно или всё же поприколу Задача не из простых и мы так же ломаем голову ай Принесите на подпись кипу бумаг И волшебника вместо явится в белом халате маг А ты кто такой Ты что потвоему доктор Ошибки опыта не лечит водка а что потом И замок на двери к счастью ковыряю штопором как дурак И до сих пор пытаюсь но так не работает И я топаю путями психотропами Вотвот сойду с ума по ним и так же не сбавляю обороты Стены давят будто в пасти у дракона Я прошу скорей открой врата в свой Изумрудный Город В мире том где есть дом до родного далеко А там и близко никакого в другом Ищу вход до сих пор; и я прошу Скорей открой врата в свой Изумрудный Город В мире том где есть дом до родного далеко А там и близко никакого в другом Ищу вход до сих пор; и я прошу Скорей открой врата в свой Изумрудный Город Семья это важно Не говорите В одной комнате со страхом всё детство учиться жить И в конце концов Принимать свои комплексы как родителей Приказано любить но любить это отвратительно Внутри заперто Рву концы Хотя может быть там душа и там может растут цветы Но ты взрослая Элли и выбрать давно пора Тебе всё вырвать из себя или вырвать себе на платье И как никак на войне с собой везде одна простая тактика Всё пихать в себя пока не перестанет брать тебя Но это тоже не помогло б ни на йоту Коль даже наркотики не работают Но всё закономерно задача не из лёгких А ты и вовсе не лучший пример но Сердца всё же требуют перемен И ждём все мы но Элли снова мажет мимо вены Ха В мире том где есть дом до родного далеко А там и близко никакого в другом Ищу вход до сих пор; и я прошу Скорей открой врата в свой Изумрудный Город В мире том где есть дом до родного далеко А там и близко никакого в другом Ищу вход до сих пор; и я прошу Скорей открой врата в свой Изумрудный Город В мире том где есть дом до родного далеко А там и близко никакого в другом Ищу вход до сих пор; и я прошу Скорей открой врата в свой Изумрудный Город В мире том где есть дом до родного далеко А там и близко никакого в другом Ищу вход до сих пор; и я прошу Скорей открой врата в свой Изумрудный Город
что отличает птицу от летучей мыши,геометрия тьмы,2022,Как ни летай тучи выше Что отличает птицу от летучей мыши И хоть крылья разные у них окажется Нету разницы ведь цель одна и та же Давно помню на крыше моей жили летучие мыши Жили там пару лет Но чердак давно уже пустой и там никого нет И я по ним случается скучаю Но делать нечего и я жму плечами Их нет за это некого ругать И на крыше одиноко но зато никто не гадит Да лучше б гадили не велика цена Они такие мне родные были Сердце пацана не вынесет всю эту ностальгию Но либо мы уходим сами либо нас покинут Исход один но всё же не об этом речь и Дерьмо случается расстраиваться нечего уу И я кидаю все несказанное в печку уу В напоминание того что всё конечно уу Mi scusi мадам Я собрать был бы рад чемодан Да и вы как хотели Отпустили Mi scusi мон мадмуазель и yу Мi scusi мадам yу Я собрать был бы рад чемодан Да и вы как хотели Отпустили Mi scusi мон мадмуазель и Я склонюсь над рекою как ива И уж если грустить то красиво И пусть если обида то детская Коль тоска то пускай только светская Для нас нет в мире тайн И если sadness то только summertime И в жизни нету места для игр Лишь боль но от боли страдать или нет это выбор Как ни летай тучи выше Что отличает птицу от летучей мыши И хоть крылья разные у них окажется Нету разницы ведь цель одна и та же Как ни летай тучи выше И что отличает птицу от летучей мыши И хоть крылья разные у них окажется Нету разницы ведь цель одна и та же
